Poltergeist; Medium undead; chaotic evil; 12; ; 22; 5d8; 0 ft., fly 50 ft. (hover); 1; 14; 11; 10; 10; 11; ; ; acid, cold, fire, lightning, thunder, bludgeoning, piercing and slashing from nonmagical weapons; necrotic, poison; charmed, exhaustion, grappled, paralyzed, petrified, poisoned, prone, restrained, unconscious; darkvision 60 ft., passive Perception 10; can't speak; 1; 200; ; Forceful Slam. Melee Weapon Attack: +4 to hit, reach 5 ft., one creature. Hit: 10 (3d6) force damage.<br>Telekinetic Thrust. The poltergeist targets a creature or unattended object within 30 feet of it. A creature must be Medium or smaller to be affected by this magic, and an object can weigh up to 150 pounds. If the target is a creature, the poltergeist makes a Charisma check contested by the target's Strength check. If the poltergeist wins the contest, the poltergeist hurls the target up to 30 feet in any direction, including upward. If the target then comes into contact with a hard surface or heavy object, the target takes 1d6 damage per 10 feet moved. If the target is an object that isn't being worn or carried, the poltergeist hurls it up to 30 feet in any direction. The poltergeist can use the object as a ranged weapon, attacking one creature along the object's path (+4 to hit) and dealing 5 (2d4) bludgeoning damage on a hit.; ; Incorporeal Movement. The specter can move through other creatures and objects as if they were difficult terrain. It takes 5 (1d10) force damage if it ends its turn inside an object.<br>Sunlight Sensitivity. While in sunlight, the specter has disadvantage on attack rolls, as well as on Wisdom (Perception) checks that rely on sight.<br>Invisibility. The poltergeist is invisible.,,,,,,,,,,,,,,,,,,,,,,,,,,,,,,,,,,,,,,Priest; Medium humanoid (any race); any alignment; 13; chain shirt; 27; 5d8+5; 25 ft.; 10; 10; 12; 13; 16; 13; ; Medicine +7, Persuasion +3, Religion +4; ; ; ; passive Perception 13; any two languages; 2; 450; ; Mace. Melee Weapon Attack: +2 to hit, reach 5 ft., one target. <br>Hit:3 (1d6) bludgeoning damage.; ; Divine Eminence.As a bonus action, the priest can expend a spell slot to cause its melee weapon attacks to magically deal an extra 10 (3d6) radiant damage to a target on a hit. This benefit lasts until the end of the turn. If the priest expends a spell slot of 2nd level or higher, the extra damage increases by 1d6 for each level above 1st.<br>Spellcasting.The priest is a 5th-level spellcaster. Its spellcasting ability is Wisdom (spell save DC 13, +5 to hit with spell attacks). The priest has the following cleric spells prepared:<br>Cantrips (at will): light,sacred flame, thaumaturgy<br>1st level (4 slots): cure wounds,guiding bolt, sanctuary<br>2nd level (3 slots): lesser restoration, spiritual weapon<br>3rd level (2 slots): dispel magic, spirit guardians,,,,,,,,,,,,,,,,,,,,,,,,,,,,,,,,,,,,,,,,,,,,,,,,,,,,,Pseudodragon; Tiny dragon; netural good; 13; natural; 7; 2d4+2; 15 ft., fly 60 ft.; 6; 15; 13; 10; 12; 10; ; Perception +3, Stealth +4; ; ; ; blindsight 10 ft., darkvision 60 ft., PP 13; understands Common and Draconic but can't speak; 1/4; 50; ; Bite. Melee Weapon Attack: +4 to hit, reach 5 ft., one target. Hit: 4 (1d4 + 2) piercing damage.<br>Sting. Melee Weapon Attack: +4 to hit, reach 5 ft., one creature. Hit: 4 (1d4 + 2) piercing damage, and the target must succeed on a DC 11 Constitution saving throw or become poisoned for 1 hour. If the saving throw fails by 5 or more, the target falls unconscious for the same duration, or until it takes damage or another creature uses an action to shake it awake.; ; Keen Senses. The pseudodragon has advantage on Wisdom (Perception) checks that rely on sight, hearing, or smell.<br><br>Magic Resistance. The pseudodragon has advantage on saving throws against spells and other magical effects.<br><br>Limited Telepathy. The pseudodragon can magically<br>communicate simple ideas, emotions, and images<br>telepathically with any creature within 100 feet of it that can understand a language.,,,,,,,,,,,,,,,,,,,,,,,,,,,,,,,,,,,,,,,,,,,,,,,,,,,Quaggoth; Medium humanoid (quaggoth); chaotic neutral; 13; natural; 45; 6d8+18; 30ft., climb 30ft.; 17; 12; 16; 6; 12; 7; ; Athletics +5; ; poison; poisoned; darkvision 120,passive perception 10; Undercommon; 2; 450; ; Multiattack. The quaggoth makes two claw attacks.<br>Claw. Melee Weapon Attack: +5 to hit, reach 5 ft., one target. Hit: 6 (ld6 + 3) slashing damage.; ; Wounded Fury. While it has 10 hit points or fewer, the<br>quaggoth has advantage on attack rolls. In addition, it deals an extra 7 (2d6) damage to any target it hits with a melee attack.,,,,,,,,,,,,,,,,,,,,,,,,,,,,,,,,,,,,,,,,,,,,,,,,,,,,,,,,,,,,Rath Modar; Medium  humanoid  (human);  lawful evil; 13; 16 with mage armor; 71; 11d8+22; 30 ft.; 11; 16; 14; 18; 14; 10;  Int +7, Wis +5; Arcana +7,  Deception +3,  Insight +5,  Stealth +6 ; ; ; ; passive Perception 12; Common,  Draconic,  Infernal,  Primordial, Thayan ; 6; 2,300; ; Quarterstaff.  Melee  Weapon Attack:  +4to  hit,  reach  5 ft.,  one target.  Hit:  4 ( 1d8)  bludgeoning damage.<br><br>Reactions <br>Illusory Self (Recharges when  Rath  Finishes a Short or Long Rest).When  a  creature  Rath  can  see  makes  an  attack roll against him,  he can  interpose an  illusory duplicate  between the attacker and  him. The attack automatically  misses  Rath, then the  illusion  dissipates.; ; Special Equipment. Rath  has  a  staff of fire, and  scrolls of dimension  door, featherfall, and  fireball.<br>Spellcasting. Rath  is  an  11th-level  spellcaster who  uses Intelligence as  his  spellcasting ability  (spell  save  DC  15, +7 to hit with  spell  attacks).  Rath  has the following spells  prepared <br>from the wizard  spell  list:<br>Cantrips  (at will) : fire  bolt,  minor illusion, prestidigitation, shocking grasp<br>1st level  (4 slots): chromatic orb,  color spray,  mage armor,  magic missile<br>2nd  level  (3  slots):  detect thoughts,  mirror image,  phantasmal force<br>3rd  level  (3  slots): counterspell, fireball,  major image<br>4th  level  (3  slots): confusion,  greater invisibility<br>5th  level  (2 slots):  mislead,  seeming<br>6th  level  (1  slot): globe  of invulnerability,,,,,,,,,,,,,,,,,,,,,,,,,,,,,,,,,,,,,Revenant; Medium undead; neutral; 13; leather armor; 136; 16d8 + 64; 30 ft.; 18; 14; 18; 13; 16; 18; Str+7, Con+7, Wis+6, Cha+7; ; necrotic, psychic; poison; charmed, exhaustion, frightened, paralyzed, poisoned, stunned; darkvision 60 ft., passive Perception 13; the languages it knew in life; 5; 1800; ; Multiattack. The revenant makes two fist attacks. <br>Fist. Melee Weapon Attack: +7 to hit, reach 5 ft., one target. Hit: 11 (2d6 + 4) bludgeoning damage. If the target is a creature against which the revenant has sworn vengeance, the target takes an extra 14 (4d6) bludgeoning damage. Instead of dealing damage, the revenant can grapple the target (escape DC 14) provided the target is Large or smaller. <br>Vengeful Glare. The revenant targets one creature it can see within 30 feet of it and against which it has sworn vengeance. The target must make a DC 15 Wisdom saving throw. On a failure, the target is paralyzed until the revenant deals damage to it, or until the end of the revenant's next turn. When the paralysis ends, the target is frightened of the revenant for 1 minute. The frightened target can repeat the saving throw at the end of each of its turns, with disadvantage if it can see the revenant, ending the frightened condition on itself on a success.; ; Regeneration. The revenant regains 10 hit points at the start of its turn. If the revenant takes fire or radiant damage, this trait doesn't function at the start of the revenant's next turn. The revenant's body is destroyed only if it starts its turn with 0 hit points and doesn't regenerate.<br><br>Rejuvenation. When the revenant's body is destroyed, its soul lingers. After 24 hours, the soul inhabits and animates another corpse on the same plane of existence and regains all its hit points. While the soul is bodiless, a wish spell can be used to force the soul to go to the afterlife and not return.<br><br>Turn Immunity. The revenant is immune to effects that turn undead.<br><br>Vengeful Tracker. The revenant knows the distance to and direction of any creature against which it seeks revenge, even if the creature and the revenant are on different planes of existence. If the creature being tracked by the revenant dies, the revenant knows.,,,,,,,,,,,,,,,,,,,,,,,,,,,,,,,,,,,,,,,,,Rezmir; Medium  humanoid  (half-black dragon); neutral evil; 13; 15 with Black Dragon Mask; 90; 12d8+36; 30 ft.; 18; 16; 16; 15; 12; 14; Dex +6,  Wis +4; Arcana +5,  Stealth +9; ; acid; charmed,  frightened; blindsight 10 ft., darkvision  120 ft.,  passive  Perception  11; Common,  Draconic,  Infernal,  Giant,  Netherese; 7; 2,900; ; Greatsword (Hazirawn).  Melee  Weapon Attack:+9 to  hit,  reach 5  ft.,  one target.  <br>Hit: 13  (2d6 +  6)  slashing damage  plus  7  (2d6) necrotic damage. <br>If the target  is  a creature,  it can't regain  hit points for  1  minute. The target can  make a  DC  15  Constitution saving throw at the end of each  of its turns,  ending this effect <br>early on  a success.<br>Caustic Bolt.  Ranged Spell Attack:+8 to hit,  range 90 ft.,  one target.  Hit: 18  (4d8)  acid  damage.<br>Acid Breath  (Recharge 5-6 ). Rezmir breathes  acid  in  a  30-foot line that is  5 feet wide.  Each  creature  in the  line  must make a DC  14  Dexterity saving throw, taking 22  (5d8)  acid damage on a failed  save,  or half as  much  damage on  a successful  one.; If she  is wearing the  Black  Dragon  Mask, Rezmir can take  up to two  legendary actions  between  each  of her turns, taking the actions all  at once or spreading them  over the  round. A <br>legendary action  can  be taken  only at the start or end of a turn. <br>Rezmir has the following legendary action  options,  some of which expend  more than  one action when taken:<br>2 Actions. A  15-foot radius  of magical  darkness  extends from <br>a  point  Rezmir can  see within  60 feet of her and  spreads around  corners. The darkness  lasts as  long as  Rezmir maintains  concentration,  up to  1  minute. A creature with <br>darkvision  can't see through this darkness,  and  no  natural light can  illuminate  it.  If any of the area overlaps with  an area  of light created  by a  spell  of 2nd  level  or lower, the spell creating the light is  dispelled. <br>1 Action.  Rezmir makes  one  melee attack. <br>1  Action.  Rezmir takes the  Hide action.; Special Equipment. Rezmir has the  Black  Dragon  Mask,Hazirawn, and  an  insignia  of claws (see appendix C for all items).<br>Amphibious. Rezmir can  breathe air and water.<br>Dark Advantage. Once  per turn,  Rezmir can  deal  an  extra  10 (3d6)  damage when  she  hits with  a weapon attack,  provided Rezmir has  advantage on the attack roll.<br>Draconic Majesty.While wearing  no armor and wearing the Black  Dragon  Mask, Rezmir adds  her Charisma  bonus to  her AC (included).<br>Immolation.When  Rezmir is  reduced to 0 hit points,  her body disintegrates  into a  pile of ash.<br>Legendary  Resistance  (1/Day). If Rezmir fails  a  saving throw while wearing the Black  Dragon  Mask, she can choose to succeed  instead.,,,,,,,,,,,,,,,,,,,,,,,,,,,,,,,,,,,Roper; Large monstrosity; neutral evil; 20; natural armor; 93; 11d10+33; 10 ft., climb 10 ft.; 18; 8; 17; 7; 16; 6; ; Perception +6, Stealth +5; ; ; ; darkvision 60 ft., passive Perception 16; ; 5; 1,800; ; Multiattack.The roper makes four attacks with its tendrils, uses Reel, and makes one attack with its bite.<br>Bite. Melee Weapon Attack: +7 to hit, reach 5 ft., one target. <br>Hit: 22 (4d8 + 4) piercing damage.<br>Tendril. Melee Weapon Attack: +7 to hit, reach 50 ft., one creature. <br>Hit:The target is grappled (escape DC 15). Until the grapple ends, the target is restrained and has disadvantage on Strength checks and Strength saving throws, and the roper can't use the same tendril on another target.Reel.The roper pulls each creature grappled by it up to 25 feet straight toward it.; ; False Appearance.While the roper remains motionless, it is indistinguishable from a normal cave formation, such as a stalagmite.<br>Grasping Tendrils. The roper can have up to six tendrils at a time. Each tendril can be attacked (AC 20, 10 hit points, immunity to poison and psychic damage). Destroying a tendril deals no damage to the roper, which can extrude a replacement tendril on its next turn. A tendril can also be broken if a <br>creature takes an action and succeeds on a DC 15 Strength check against it.<br>Spider Climb. The roper can climb difficult surfaces, including upside down on ceilings, without needing to make an ability check.,,,,,,,,,,,,,,,,,,,,,,,,,,,,,,,,,,,,,,,,,,,,,,,Rug of Smothering; Large construct; unaligned; 12; ; 33; 6d10; 10 ft.; 17; 14; 10; 1; 3; 1; ; ; ; poison, psychic; blinded, charmed, deafened, frightened,  paralyzed, petrified, poisoned; blindsight 60 ft. (blind beyond this radius), passive Perception 6; ; 2; 450; ; Smother. Melee Weapon Attack: +5 to hit, reach 5 ft., one Medium or smaller creature. <br>Hit:The creature is grappled (escape DC 13). Until this grapple ends, the target is restrained blinded, and at risk of suffocating, and the rug can't smother another target. In addition, at the start of each of the target's turns, the target takes 10 (2d6 + 3) bludgeoning damage.<br>; ; Antimagic Susceptibility.The rug is incapacitated while in the area of an antimagic field.If targeted by dispel magic, the rug must succeed on a Constitution saving throw against the caster's spell save DC or fall unconscious for 1 minute.<br>Damage Transfer.While it is grappling a creature, the rug takes only half the damage dealt to it, and the creature grappled by the rug takes the other half.<br>False Appearance.While the rug remains motionless, it is indistinguishable from a normal rug.,,,,,,,,,,,,,,,,,,,,,,,,,,,,,,,,,,,,,,,,,,,,,,,Scout; Medium humanoid (any race); any alignment; 13; leather armor; 16; 3d8+3; 30 ft.; 11; 14; 12; 11; 13; 11; ; Nature +4, Perception +5, Stealth +6, Survival +5; ; ; ; passive Perception 15; any one language (usually Common; 1/2; 100; ; Multiattack. The scout makes two melee attacks or two ranged attacks.<br>Shortsword. Melee Weapon Attack: +4 to hit, reach 5 ft., one target.<br> Hit:5 (1d6 + 2) piercing damage.<br>Longbow. Ranged Weapon Attack: +4 to hit, ranged 150/600 ft., one target. <br>Hit: 6 (1d8 + 2) piercing damage.<br>; ; Keen Hearing and Sight.The scout has advantage on Wisdom (Perception) checks that rely on hearing or sight.,,,,,,,,,,,,,,,,,,,,,,,,,,,,,,,,,,,,,,,,,,,,,,,,,,,,,,,,,,,Shambling Mound; Large plant; unaligned; 15; natural armor; 136; 16d10+48; 20 ft., swim 20 ft.; 18; 8; 16; 5; 10; 5; ; Stealth +2; cold, fire; lightning; blinded, deafened, exhaustion; blindsight 60 ft. (blind beyond this radius), passive Perception 10; ; 5; 1,800; ; Multiattack.The shambling mound makes two slam attacks. If both attacks hit a Medium or smaller target, the target is grappled (escape DC 14), and the shambling mound uses its Engulf on it.<br>Slam. Melee Weapon Attack:+7 to hit, reach 5 ft., one target. <br>Hit:13 (2d8 + 4) bludgeoning damage.<br>Engulf. The shambling mound engulfs a Medium or smaller creature grappled by it. The engulfed target is blinded, restrained, and unable to breathe, and it must succeed on a DC 14 Constitution saving throw at the start of each of the mound's turns or take 13 (2d8 + 4) bludgeoning damage. If the mound moves, the engulfed target moves with it. The mound can have only one creature engulfed at a time.<br>; ; Lightning Absorption. Whenever the shambling mound is subjected to lightning damage, it takes no damage and regains a number of hit points equal to the lightning damage dealt.,,,,,,,,,,,,,,,,,,,,,,,,,,,,,,,,,,,,,,,,,,,,,,,,,,,Skeleton; Medium undead; lawful evil; 13; armor scraps; 13; 2d8+4; 30 ft.; 10; 14; 15; 6; 8; 5; ; ; ; poison; exhaustion, poisoned; darkvision 60 ft., passive Perception 9; understands all languages it knew in life but can't speak; 1/4; 50; ; Shortsword. Melee Weapon Attack: +4 to hit, reach 5 ft., one target. Hit: 5 (1d6 + 2) piercing damage.<br><br>Shortbow. Ranged Weapon Attack: +4 to hit, range 80/320 ft ., one target. Hit: 5 (1d6 + 2) piercing damage.; ; Damage Vulnerabilities: bludgeoning<br>,,,,,,,,,,,,,,,,,,,,,,,,,,,,,,,,,,,,,,,,,,,,,,,,,,,,,,,,,,,,Spectator; Medium aberration; lawful neutral; 14; natural armor; 39; ; fly 30 ft. (hover); 8; 14; 14; 13; 14; 11; ; Perception +6; ; ; Prone; darkvision 120 ft., passive Perception 16; Deep Speech, Undercommon, telepathy, 120 ft.; 3; 700; ; Bite. Melee Weapon Attack: +1 to hit, reach 5 ft., one target. Hit: 2 (1d6- 1) piercing damage. <br><br>Eye Rays. The spectator shoots up to two of the following magical eye rays at one or two creatures it can see within 90 feet of it. It can use each ray only once on a turn.<br><br>1. Confusion Ray. The target must succeed on a DC 13 Wisdom saving throw, or it can't take reactions until the end of its next turn. On its turn, the target can't move, and it uses its action to make a melee or ranged attack agaiAst a randomly determined creature within range. If the target can't attack, it does nothing on its turn.<br><br>2. Paralyzing Ray. The target must succeed on a DC 13 Constitution saving throw or be paralyzed for 1 minute. The target can repeat the saving throw at the end of each of its turns, ending the effect on itself on a success. <br><br>3. Fear Ray. The target must succeed on a DC 13 Wisdom saving throw or be frightened for 1 minute. The target can repeat the saving throw at the end of each of its turns, with disadvantage if the spectator is visible to the target, ending the effect on itself on a success.<br><br>4. Wounding Ray. The target must make a DC 13 Constitution saving throw, taking 16 (3d10) necrotic damage on a failed save, or half as much damage on a successful one. <br><br>Create Food and Water. The spectator magically creates enough food and water to sustain itself for 24 hours.<br><br>Spell Reflection. If the spectator makes a successful saving throw against a spell, or a spell attack misses it, the spectator can choose another creature (including the spellcaster) it can see within 30 feet of it. The spell targets the chosen creature instead of the spectator. If the spell forced a saving throw, the chosen creature makes its own save. If the spell was an attack, the attack roll is rerolled against the chosen creature. ; ; ,,,,,,,,,,,,,,,,,,,,,,,,,,,,,,,,,,,,,,,,,,,,,,,Specter; Medium undead; chaotic evil; 12; ; 22; 5d8; 0 ft., fly 50 ft. (hover); 1; 14; 11; 10; 10; 11; ; ; acid, cold, fire, lightning, thunder,  bludgeoning, piercing, and slashing from nonmagical  weapons Damage Im; necrotic, poison; charmed, exhaustion, grappled,  paralyzed, petrified, poisoned, prone, restrained,  unconscious; darkvision 60 ft., passive Perception 10; understands all languages it knew in life but can't  speak; 1; 200; ; Life Drain. Melee Spell Attack: +4 to hit, reach 5 ft., one creature. <br>Hit:10 (3d6) necrotic damage. The target must succeed on a DC 10 Constitution saving throw or its hit point maximum is reduced by an amount equal to the damage taken. This reduction lasts until the creature finishes a long rest. The target dies if this effect reduces its hit point maximum to 0.<br>; ; Incorporeal Movement. The specter can move through other creatures and objects as if they were difficult terrain. It takes 5 (1d10) force damage if it ends its turn inside an object.<br>Sunlight Sensitivity.While in sunlight, the specter has disadvantage on attack rolls, as well as on Wisdom (Perception) checks that rely on sight.,,,,,,,,,,,,,,,,,,,,,,,,,,,,,,,,,,,,,,,,,,,,Specter; Medium undead; chaotic evil; 12; ; 22; 5d8; 0 ft., fly 50 ft. (hover); 1; 14; 11; 10; 10; 11; ; ; acid, cold, fire, lightning, thunder, bludgeoning, piercing and slashing from nonmagical weapons; necrotic, poison; charmed, exhaustion, grappled, paralyzed, petrified, poisoned, prone, restrained, unconcious; darkvision 60 ft., passive Perception 10; can't speak; 1; 200; ; Life Drain. Melee Spell Attack: +4 to hit, reach 5 ft. , one creature. Hit: 10 (3d6) necrotic damage. The target must succeed on a DC 10 Constitution saving throw or its hit point maximum is reduced by an amount equal to the damage taken. This reduction lasts until the creature finishes a long rest. The target dies if this effect reduces its hit point maximum to 0.; ; Incorporeal Movement. The specter can move through other creatures and objects as if they were difficult terrain. It takes 5 (1d10) force damage if it ends its turn inside an object.<br>Sunlight Sensitivity. While in sunlight, the specter has disadvantage on attack rolls, as well as on Wisdom (Perception) checks that rely on sight.,,,,,,,,,,,,,,,,,,,,,,,,,,,,,,,,,,,,,,,,,,,,,Spy; Medium humanoid (any race); any alignment; 12; ; 27; 6d8; 30 ft.; 10; 15; 10; 12; 14; 16; ; Deception +5, Insight +4, Investigation +5, Perception +6,  Persuasion +5, Sleight of Hand +4, Stealth +4; ; ; ; passive Perception 16; any two languages; 1; 200; ; Multiattack.The spy makes two melee attacks.<br>Shortsword. Melee Weapon Attack: +4 to hit, reach 5 ft., one target.<br>Hit:5 (1d6 + 2) piercing damage.<br>Hand Crossbow. Ranged Weapon Attack: +4 to hit, range 30/120 ft., one target. <br>Hit:5 (1d6 + 2) piercing damage.<br>; ; Cunning Action.On each of its turns, the spy can use a bonus action to take the Dash, Disengage, or Hide action.<br>Sneak Attack (1/Turn).The spy deals an extra 7 (2d6) damage when it hits a target with a weapon attack and has advantage on the attack roll, or when the target is within 5 feet of an ally of the spy that isn't incapacitated and the spy doesn't have disadvantage on the attack roll.,,,,,,,,,,,,,,,,,,,,,,,,,,,,,,,,,,,,,,,,,,,,,,,,,,,,Stirge; Tiny beast; unaligned; 14; natural armor; 2; 1d4; 10 ft., fly 40 ft.; 4; 16; 11; 2; 8; 6; ; ; ; ; ; darkvision 60 ft., passive Perception 9; ; 1/8; 25; ; Blood Drain. Melee Weapon Attack:+5 to hit, reach 5 ft., one creature. <br>Hit:5 (1d4 + 3) piercing damage, and the stirge attaches to the target. While attached, the stirge doesn't attack. Instead, at the start of each of the stirge's turns, the target loses 5 (1d4 + 3) hit points due to blood loss.The stirge can detach itself by spending 5 feet of its movement. It does so after it drains 10 hit points of blood from the target or the target dies. A creature, including the target, can use its action to detach the stirge.; ;,,,,,,,,,,,,,,,,,,,,,,,,,,,,,,,,,,,,,,,,,,,,,,,,,,,,,,,,Stone Giant; Huge giant; neutral; 17; natural armor; 126; 11d12+55; 40 ft.; 23; 15; 20; 10; 12; 9; Dex +5, Con +8, Wis +4; Athletics +12, Perception +4; ; ; ; darkvision 60 ft., passive Perception 14; Giant; 7; 2,900; ; Multiattack.The giant makes two greatclub attacks.<br>Greatclub. Melee Weapon Attack: +9 to hit, reach 15 ft., one target. <br>Hit:19 (3d8 + 6) bludgeoning damage.<br>Rock. Ranged Weapon Attack: +9 to hit, range 60/240 ft., one target. <br>Hit:28 (4d10 + 6) bludgeoning damage. If the target is a creature, it must succeed on a DC 17 Strength saving throw or be knocked prone.<br><br>Reaction<br>Rock Catching.If a rock or similar object is hurled at the giant the giant can, with a successful DC 10 Dexterity saving throw, catch the missile and take no bludgeoning damage from it.; ;,,,,,,,,,,,,,,,,,,,,,,,,,,,,,,,,,,,,,,,,,,,,,,,,,,,,,,Stone Golem; Large construct; unaligned; 17; natural armor; 178; 17d10+85; 30 ft.; 22; 9; 20; 3; 11; 1; ; ; ; poison, psychic, bludgeoning, piercing,  and slashing from nonmagical weapons that aren't  adamantine; charmed, exhaustion, frightened,  paralyzed, petrified, poisoned; darkvision 120 ft., passive Perception 10; understands the languages of its creator but can't  speak; 10; 5,900; ; Multiattack.The golem makes two slam attacks.<br>Slam. Melee Weapon Attack: +10 to hit, reach 5 ft., one target. <br>Hit:19 (3d8 + 6) bludgeoning damage.<br>Slow (Recharge 5-6).The golem targets one or more creatures it can see within 10 feet of it. Each target must make a DC 17 Wisdom saving throw against this magic. On a failed save, a target can't use reactions, its speed is halved, and it can't make more than one attack on its turn. In addition, the target can take either an action or a bonus action on its turn, not both. These effects last for 1 minute. A target can repeat the saving throw at the end of each of its turns, ending the effect on itself on a success.<br>; ; Immutable Form.The golem is immune to any spell or effect that would alter its form.<br>Magic Resistance.The golem has advantage on saving throws against spells and other magical effects.<br>Magic Weapons.The golem's weapon attacks are magical.,,,,,,,,,,,,,,,,,,,,,,,,,,,,,,,,,,,,,,,,,,,,,,,