Ghost; Medium undead; any alignment; 11; ; 45; 10d8; 0 ft., fly 40 ft.; 7; 13; 10; 10; 12; 17; ; ; acid, fire, lightning, thunder, bludgeoning, piercing and slashing from nonmagical weapons; cold, necrotic, poison; charmed, exhaustion, frightened, grappled, paralyzed, petrified, poisoned, prone, restrained; darkvision 60 ft., passive Perception 11; any languages it knew in life; 4; 1100; ; Withering Touch. Melee Weapon Attack: +5 to hit, reach 5 ft., one target. Hit: 17 (4d6 + 3) necrotic damage.<br>Etherealness. The ghost enters the Ethereal Plane from the Material Plane, or vice versa. It is visible on the Material Plane while it is in the Border Ethereal, and viae versa, yet it can't affect or be affected by anything on the other plane.<br>Horrifying Visage. Each non-undead creature within 60 feet of the ghost that can see it must succeed on a DC 13 Wisdom saving throw or be frightened for 1 minute. If the save fails by 5 or more, the target also ages 1d4 x 10 years. A frightened target can repeat the saving throw at the end of each of its turns, ending the frightened condition on itself on a success. If a target's saving throw is successful or the effect ends for it, the target is immune to this ghost's Horrifying Visage for the next 24 hours. The aging effect can be reversed with a greater restoration spell, but only within 24 hours of it occurring. <br>Possession (Recharge 6). One humanoid that the ghost can seewithin 5 feet of it must succeed on a DC 13 Charisma saving throw or be possessed by the ghost, the ghost then disappears, and the target is inca pacitated and loses control of its body. The ghost now controls the body but doesn't deprive the target of awareness. The ghost can't be targeted by any attack, spell, or other effect, except ones that turn undead, and it retains its alignment, Intelligence, Wisdom, Charisma, and immunity to being charmed and frightened . It otherwise uses the possessed target's statistics, but doesn't gain access to the target's knowledge, class features, or proficiencies. The possession lasts until the body drops to 0 hit points, the ghost ends it as a bonus action, or the ghost is turned or forced out by an effect li ke the dispel evil and good spell. When the possession ends, the ghost reappears in an unoccupied space within 5 feet of the body. The target is immune to this ghost's Possession for 24 hours after succeeding on the saving throw or after the possession ends.<br>; ; Ethereal Sight. The ghost can see 60 feet into the Ethereal<br>Plane when it is on the Material Plane, and vice versa.<br><br>Incorporeal Movement. The ghost can move through other<br>creatures and objects as if they were difficult terrain. It takes 5 (1d10) force damage if it ends its turn in side an object.,,,,,,,,,,,,,,,,,,,,,,,Ghoul; Medium undead; chaotic evil; 12; ; 22; 5d8; 30 ft.; 13; 15; 10; 7; 10; 6; ; ; ; poison; charmed, exhaustion, poisoned; darkvision 60 ft., passive Perception 10; Common; 1; 200; ; Bite. Melee Weapon Attack: +2 to hit, reach 5 ft., one creature. Hit: 9 (2d6 + 2) piercing damage.<br>Claws. Melee Weapon Attack: +4 to hit, reach 5 ft., one target. Hit: 7 (2d4 + 2) slashing damage. If the target is a creature other than an elf or undead, it must succeed on a DC 10 Constitution saving throw or be paralyzed for 1 minute. The target can repeat the saving throw at the end of each of its turns, ending the effect on itself on a success.; ; ,,,,,,,,,,,,,,,,,,,,,,,,,,,,,,,,,,,,,,,,,,,,,,,,,,,,,,,,,Giant Centipede; Small beast; unaligned; 13; natural armor; 4; 1d6+1; 30 ft., climb 30 ft.; 5; 14; 12; 1; 7; 3; ; ; ; ; ; blindsight 30 ft., passive Perception 8; ; 1/4; 50; ; Bite. Melee Weapon Attack:+4 to hit, reach 5 ft., one creature. <br>Hit:4 (1d4 + 2) piercing damage, and the target must succeed on a DC 11 Constitution saving throw or take 10 (3d6) poison damage. If the poison damage reduces the target to 0 hit points, the target is stable but poisoned for 1 hour, even after regaining hit points, and is paralyzed while poisoned in this way.<br>; ;,,,,,,,,,,,,,,,,,,,,,,,,,,,,,,,,,,,,,,,,,,,,,,,,,,,,,,,,,,Giant Fire Beetle; small beast; unaligned; 13; natural; 4; 1d6+1; 30 ft.; 8; 10; 12; 1; 7; 3; ; ; ; ; ; blindsight 30 ft., passive Perception 8; --; 0; 10; A giant fire beetle is a nocturnal creature that takes its<br>name from a pair of glowing glands that give off light.<br>Miners and adventurers prize these creatures, for a<br>giant fire beetle's glands continue to shed light for 1d6<br>days after the beetle dies. Giant fire beetles are most<br>commonly found underground and in dark forests.; Bite. Melee Weapon Attack:+ 1 to hit, re ach 5 ft., one target. Hit: 2 (1d6- 1) slashing damage.; ; Illumination. The beetle sheds bright light in a 10-foot radius<br>and dim light for an additional 10 feet.,,,,,,,,,,,,,,,,,,,,,,,,,,,,,,,,,,,,,,,,,,,,,,,,,,,,,,,,,,,,,,Giant Frog; Medium beast; unaligned; 11; ; 18; 4d8; 30 ft., swim 30 ft.; 12; 13; 11; 2; 10; 3; ; Perception +2, Stealth +3; ; ; ; darkvision 30 ft., passive Perception 12; ; 1/4; 50; ; Bite. Melee Weapon Attack: +3 to hit, reach 5 ft., one target. <br>Hit:4 (1d6 + 1) piercing damage, and the target is grappled (escape DC 11). Until this grapple ends, the target is restrained, and the frog can't bite another target.<br>Swallow. The frog makes one bite attack against a Small or smaller target it is grappling. If the attack hits, the target is swallowed, and the grapple ends. The swallowed target is blinded and restrained, it has total cover against attacks and other effects outside the frog, and it takes 5 (2d4) acid damage at the start of each of the frog's turns. The frog can have only one target swallowed at a time.If the frog dies, a swallowed creature is no longer restrained by it and can escape from the corpse using 5 feet of movement, exiting prone.<br>; ; Amphibious.The frog can breathe air and water.<br>Standing Leap. The frog's long jump is up to 20 feet and its high jump is up to 10 feet, with or without a running start.,,,,,,,,,,,,,,,,,,,,,,,,,,,,,,,,,,,,,,,,,,,,,,,,,,,Giant Lizard; Large beast; unaligned; 12; natural armor; 19; 3d10+3; 30 ft., climb 30 ft.; 15; 12; 13; 2; 10; 5; ; ; ; ; ; darkvision 30 ft., passive Perception 10; ; 1/4; 50; ; Bite. Melee Weapon Attack: +4 to hit, reach 5 ft., one target. <br>Hit: 6 (1d8 + 2) piercing damage.; ;,,,,,,,,,,,,,,,,,,,,,,,,,,,,,,,,,,,,,,,,,,,,,,,,,,,,,,,,,,,,,,Giant Owl; Large best; neutral;12; ;19; 3d10 + 3; 5ft, fly 60ft;13;15;12;8;13;10; ; Perception +5, Stealth +4; ; ; ; darkvision 120ft, PP 15; Giant Owl, understands Common, Elvish and Sylvan, but can't speak them; 1/4;50; ; <b>Talons.</b> <i>Melee Weapon Attack:</i> +3 to hit, reach 5ft, one target. <i>Hit:</i> 8 (2d6 + 1) slashing damage; ; <b>Flyby.</b> The owl doesn't provoke oportunity attacks when it flies out of an enemy's reach.<br><br><b>Keen Hearing and Sight.</b> The owl has advantage on WIS (Perception) checks that rely on hearing or sight.,,,,,,,,,,,,,,,,,,,,,,,,,,,,,,,,,,,,,,,,,,,,,,,,,,,,,,,,,,Giant Rocktopus; Large Beast; unaligned; 11; ; 52; 8d10+8; 20 ft., climb 10ft.; 17; 13; 13; 4; 10; 4; ; Perception +4, Stealth +5; ; ; ; darkvision 60 ft., passive Perception 14; --; 1; 200; ; Tentacles. Melee Weapon Attack: +5 to hit, reach 15 ft., one target. Hit: 10 (2d6 + 3) bludgeoning damage. If the target is a creature, it is grappled (escape DC 16). Until this grapple ends, the target is restrained, and the octopus can't use its tentacles on another target.; ; Camouflage. The octopus has advantage on<br>Dexterity (Stealth) checks.,,,,,,,,,,,,,,,,,,,,,,,,,,,,,,,,,,,,,,,,,,,,,,,,,,,,,,,,,,Giant Spider; Large beast; unaligned; 14; natural Armor; 26; 4d10+4; 30 ft., climb 30 ft.; 14; 16; 12; 2; 11; 4; ; Stealth +7; ; ; ; blindsight 10 ft., darkvision 60 ft., passive Perception 10; ; 1; 200; ; Bite. Melee Weapon Attack: +5 to hit, reach 5 ft., one creature. <br>Hit:7 (1d8 + 3) piercing damage, and the target must make a DC 11 Constitution saving throw, taking 9 (2d8) poison damage on a failed save, or half as much damage on a successful one. If the poison damage reduces the target to 0 hit points, the target is stable but poisoned for 1 hour, even after regaining hit points, and is paralyzed while poisoned in this way.<br>Web (Recharge 5-6). Ranged Weapon Attack:+5 to hit, range 30/60 ft., one creature.Hit:The target is restrained by webbing. As an action, the restrained target can make a DC 12 Strength check, bursting the webbing on a success. The webbing can also be attacked and destroyed (AC 10, hp 5, vulnerability to fire damage, immunity to bludgeoning, poison, and psychic damage).<br>; ; Spider Climb. The spider can climb difficult surfaces, including upside down on ceilings, without needing to make an ability check.<br>Web Sense.While in contact with a web, the spider knows the exact location of any other creature in contact with the same web.<br>Web Walker.The spider ignores movement restrictions caused by webbing.,,,,,,,,,,,,,,,,,,,,,,,,,,,,,,,,,,,,,,,,,,,Giant Vulture; Large beast; neutral evil; 10; ; 22; (3d10 + 6); 10 ft., fly 60 ft.; 15; 10; 15; 6; 12; 7; ; Perception +3; ; ; ; passive Perception 13; understands Common but can't speak; 1; 200; Keen Sight and Smell. The vulture has advantage on Wisdom (Perception) checks that rely on sight or smell.<br><br>Peak Tactics. The vulture has advantage on an attack roll against a creature if at least one of the vulture's allies is within 5 feet of the creature and the ally isn't incapacitated.; Multiattack. The vulture makes two attacks: one with its beak and one with its talons.<br><br>Beak. Melee Weapon Attack: +4 to hit, reach 5 ft., one target. Hit: 7 (2d4 + 2) piercing damage.<br><br>Talons. Melee Weapon Attack: +4 to hit, reach 5 ft., one target. Hit: 9 (2d6 + 2) slashing damage.; ; ,,,,,,,,,,,,,,,,,,,,,,,,,,,,,,,,,,,,,,,,,,,,,,,,,,,,,,,,,,,,,Gnoll Pack Lord; Medium humanoid (gnoll); chaotic evil; 15; chain shirt; 49; 9d8+9; 30 ft.; 16; 14; 13; 8; 11; 9; ; ; ; ; ; darkvision 60 ft., passive Perception 10; Gnoll; 2; 450; ; Multiattack. The gnoll makes two attacks, either with its glaive or its longbow, and uses its Incite Rampage if it can.<br><br>Bite. Melee Weapon Attack: +5 to hit, reach 5 ft., one creature. Hit: 5 (1d4 + 3) piercing damage.<br><br>Glaive. Melee Weapon Attack: +5 to hit, reach 10ft., one target. Hit: 8 (1d10 + 3) slashing damage.<br><br>Longbow. Ranged Weapon Attack: +4 to hit, range 150/600 ft ., one target. Hit: 6 (1d8 + 2) piercing damage.<br><br>Incite Rampage (Recharge 5-6). One creature the gnoll can see within 30 feet of it can use its reaction to make a melee attack if it can hear the gnoll and has the Rampage trait.; ; Rampage. When the gnoll reduces a creature to 0 hit points<br>with a melee attack on its turn , the gnoll can take a bonus<br>action to move up to half its speed and make a bite attack.,,,,,,,,,,,,,,,,,,,,,,,,,,,,,,,,,,,,,,,,,,,,,,,,,,,,,,,,Gnoll; Medium humanoid (knoll); chaotic evil; 15; hide armor, shield; 22; 5d8; 30 ft.; 14; 12; 11; 6; 10; 7; ; ; ; ; ; darkvision 60 ft., passive Perception 10; Gnoll; 1/2; 100; ; Bite. Melee Weapon Attack: +4 to hit, reach 5 ft ., one creature. Hit: 4 (1d4 + 2) piercing damage.<br><br>Spear. Melee or Ranged Weapon Attack: +4 to hit, reach 5 ft. or range 20J60 ft ., one target. Hit: 5 (1d6 + 2) piercing damage, or 6 (1 d8 + 2) piercing damage if used with two hands to make a melee attack.<br><br>Longbow. Ranged Weapon Attack: +3 to hit, range 150/600 ft. , one target. Hit: 5 (1d8 + 1) piercing damage.; ; Rampage. When the gnoll reduces a creature to 0 hit points<br>with a melee attack on its turn, the gnoll can take a bonus<br>action to move up to half its speed and make a bite attack.,,,,,,,,,,,,,,,,,,,,,,,,,,,,,,,,,,,,,,,,,,,,,,,,,,,,,,,,Goblin; Small humanoid (goblinoid); neutral evil;15; leather armor, shield;7; 2d6; 30ft;8;14;10;10;8;8; ; Stealth +6; ; ; ; darkvision 60ft, PP 9; Common, Goblin; 1/4;50; ; <b>Scimitar.</b> <i>Melee Weapon Attack:</i> +4 to hit, reach 5ft, one target. <i>Hit:</i> 5 (1d6 + 2) slashing damage.<br><br><b>Shortbow.</b> <i>Ranged Weapon Attack:</i> +4 to hit, range 80/320ft, one target. <i>Hit:</i> 5 (1d6 +2) piercing damage; ; <b>Nimble Escape.</b> The goblin can take the Disengage or Hide action as a bonus action on each of its turns,,,,,,,,,,,,,,,,,,,,,,,,,,,,,,,,,,,,,,,,,,,,,,,,,,,,,,,,,,,Gorgon; Large monstrosity; unaligned; 19; natural; 114; 12d10+48; 40 ft.; 20; 11; 18; 2; 12; 7; ; Perception +4; ; ; petrified; darkvision 60 ft., PP 14; ; 5; 1800; ; Gore. Melee Weapon Attack: +8 to hit, reach 5 ft., one target. Hit: 18 (2d12 + 5) piercing damage.<br><br>Hooves. Melee Weapon Attack: +8 to hit, reach 5 ft., one target. Hit: 16 (2d10 + 5) bludgeoning damage.<br><br>Petrifying Breath (Recharge 5-6). The gorgon exhales<br>petrifying gas in a 30-foot cone. Each creature in that area<br>must succeed on a DC 13 Constitution saving throw. On a<br>failed save, a target begins to turn to stone and is restrained. The restrained target must repeat the saving throw at the end of its next turn. On a success, the effect ends on the target. On a failure, the target is petrified until freed by the greater restoration spell or other magic.; ; Trampling Charge. If the gorgon moves at least 20 feet straight toward a creature and then hits it with a gore attack on the same turn, that target must succeed on a DC 16 Strength saving throw or be knocked prone. If the target is prone, the gorgon can make one attack with its hooves against it as a bonus action.,,,,,,,,,,,,,,,,,,,,,,,,,,,,,,,,,,,,,,,,,,,,,,,,,,,,,,,,Gray ooze; Medium ooze; unaligned; 8; ; 22; 3d8+9; 10 ft., climb 10 ft.; 12; 6; 16; 1; 6; 2; ; Stealth +2; acid, cold, fire; ; blinded, charmed, deafened, exhaustion, frightened, prone; blindsight 60 ft. (blind beyond this radius), passive Perception 8; ; 1/2; 100; ; Pseudopod. Melee Weapon Attack:+3 to hit, reach 5 ft., one target. <br>Hit:4 (1d6 + 1) bludgeoning damage plus 7 (2d6) acid damage, and if the target is wearing nonmagical metal armor, its armor is partly corroded and takes a permanent and cumulative äšÍ1 penalty to the AC it offers. The armor is destroyed if the penalty reduces its AC to 10.<br>; ; Amorphous. The ooze can move through a space as narrow as 1 inch wide without squeezing.<br>Corrode Metal.Any nonmagical weapon made of metal that hits the ooze corrodes. After dealing damage, the weapon takes a permanent and cumulative äšÍ1 penalty to damage rolls.If its penalty drops to äšÍ5, the weapon is destroyed. Nonmagical ammunition made of metal that hits the ooze is destroyed after dealing damage.<br>The ooze can eat through 2-inch-thick, nonmagical metal in 1 round.<br>False Appearance.While the ooze remains motionless, it is indistinguishable from an oily pool or wet rock.,,,,,,,,,,,,,,,,,,,,,,,,,,,,,,,,,,,,,,,,,,,,,,,,,Green Hag; Medium Fey; neutral evil; 17; natural armor; 82; 11d8+33; 30 ft.; 18; 12; 16; 13; 14; 14; ; Arcana +3, Deception +4, Perception +4, Stealth +3; ; ; ; darkvision 60 ft., passive perception 14; Common, Draconic, Sylvan; 3; 700; ; Claws. Melee Weapon Attack: +6 to hit, reach 5 ft., one target. Hit: 13 (2d8 + 4) slashing damage.<br><br>Illusory Appearance. The hag covers herself and anything she is wearing or carrying with a magical illusion that makes her look like another creature of her general size and humanoid shape. The illusion ends if the hag takes a bonus action to end it or if she dies. The changes wrought by this effect fail to hold up to physical inspection. For example, the hag could appear to have smooth skin, but someone touching her would feel her rough flesh. Otherwise, a creature must take an action to visually inspect the illusion and succeed on a DC 20 Intelligence (Investigation) check to discern that the hag is disguised.<br><br>Invisible Passage. The hag magically turns invisible until she attacks or casts a spell, or until her concentration ends (as if concentrating on a spell). While invisible, she leaves no physical evidence of her passage, so she can be tracked only by magic. Any equipment she wears or carries is invisible with her.; ; Amphibious. The hag can breathe air and water.<br><br>Innate Spellcasting. The hag's innate spellcasting ability<br>is Charisma (spell save DC 12). She can innately cast the<br>following spells, requiring no material components:<br>At will: dancing lights, minor illusion, vicious mockery<br><br>Mimicry. The hag can mimic animal sounds and humanoid<br>voices. A creature that hears the sounds can tell they are<br>imitations with a successful DC 14 Wisdom (Insight) cheok.,,,,,,,,,,,,,,,,,,,,,,,,,,,,,,,,,,,,,,,,,,,,,,,,,Grell; Medium aberration; neutral evil; 12; ; 55; 10d8+10; 10ft., fly 30 ft. (hover); 15; 14; 13; 12; 11; 9; ; Perception +4, Stealth +6; ; lightning; blinded, prone; blindsight 60 ft. (blind beyond this radius) passive perception 14; Grell; 3; 700; ; Multiattack. The grell makes two attacks: one with its tentacles and one with its beak.<br><br>Tentacles. Melee Weapon Attack: +4 to hit, reach 10ft., one creature. Hit: 7 (1d10 + 2) piercing damage, and the target must succeed on a DC 11 Constitution saving throw or be poisoned for 1 minute. The poisoned target is paralyzed, and it can repeat the saving throw at the end of each of its turns, ending the effect on a success. The target is also grappled (escape DC 15). If the target is<br>Medium or smaller, it is also restrained until this grapple ends. While grappling the target, the grell has advantage on attack rolls against it and can 't use this attack against other targets. When the grell moves, any Medium or smaller target it is grappling moves with it.<br><br>Beak. Melee Weapon Attack: +4 to hit, reach 5 ft. , one creature. Hit: 7 (2d4 + 2) piercing damage.; ; ,,,,,,,,,,,,,,,,,,,,,,,,,,,,,,,,,,,,,,,,,,,,,,,,,,,,,Griffon; Large monstrosity; unaligned; 12; ; 59; 7d10+21; 30 ft., fly 80 ft.; 18; 15; 16; 2; 13; 8; ; Perception +5; ; ; ; darkvision 60 ft., passive Perception 15; ; 2; 450; ; Multiattack. The griffon makes two attacks: one with its beak and one with its claws.<br>Beak. Melee Weapon Attack: +6 to hit, reach 5 ft., one target.<br>Hit:8 (1d8 + 4) piercing damage.<br>Claws. Melee Weapon Attack: +6 to hit, reach 5 ft., one target. <br>Hit:11 (2d6 + 4) slashing damage.<br>; ; Keen Sight.The griffon has advantage on Wisdom (Perception) checks that rely on sight.,,,,,,,,,,,,,,,,,,,,,,,,,,,,,,,,,,,,,,,,,,,,,,,,,,,,,,,,,,,,Guard Drake; medium Dragon; unaligned; 14; natural armor; 52; 7d8+21; 30 ft.; 16; 11; 16; 4; 10; 7; Perception +2; ; Lightning; ; ; darkvision 60ft., passive Perception 12; understands Draconic but can't speak; 2; 450; ; Multiattack.The drake attacks twice, once with its bite and once with its tail.<br>Bite. Melee Weapon Attack:+5 to hit, reach 5 ft., one target.<br>Hit: 7 ( 1d8 + 3) piercing damage.<br>Tail. Melee Weapon Attack:+5 to hit, reach 5 ft., one target. <br>Hit: 6 (1d6 + 3) bludgeoning damage.; ;,,,,,,,,,,,,,,,,,,,,,,,,,,,,,,,,,,,,,,,,,,,,,,,,,,,,,,,,,,,,Guard; Medium humanoid (any race); any alingment;16; chain shirt, shield;11; 2d8 + 2; 30ft;13;12;12;10;11;10; ; Perception +2; ; ; ; PP 12; any one language (usually Common); 1/8;25; ; <b>Spear.</b> <i>Melee or Ranged Weapon Attack:</i> +3 to hit, reach 5ft, or range 20/60ft, one target. <i>Hit:</i> 4 (1d6 + 1) piercing damage.; ; ,,,,,,,,,,,,,,,,,,,,,,,,,,,,,,,,,,,,,,,,,,,,,,,,,,,,,,,,,,,,,,Half-Red Dragon Veteran; Medium humanoid (human); any alignment; 18; plate; 65; 10d8+20; 30 ft.; 16; 13; 14; 10; 11; 10; Str +5, Con +4; Athletics +5, Perception +2; Fire; ; ; Blindsight 10 ft., darkvision 60 ft., PP 12; Common, Draconic; 5; 1800; ; Multiattack. The veteran makes two longsword attacks. If it has a shortsword drawn, it can also make a shortsword attack.<br><br>Longsword. Melee Weapon Attack: +5 to hit, reach 5 ft., one target. Hit: 7 (1d8 + 3) slashing damage, or 8 (1d10 + 3) slashing damage if used with two hands.<br><br>Shortsword. Melee Weapon Attack: +5 to hit, reach 5 ft., one target. Hit: 6 (1d6 + 3) piercing damage.<br><br>Heavy Crossbow. Ranged Weapon Attack: +3 to hit, range 100/400 ft., one target. Hit: 6 (1d10 + 1) piercing damage. <br><br>Fire Breath (Recharge 5-6). The veteran exhales fire in a 15-foot cone. Each creature in that area must make a DC 15 Dexterity saving throw, taking 24 (7d6) fire damage on a failed save, or half as much damage on a successful one.<br><br>Reactions<br><br>Parry. The veteran adds 3 to its AC against one melee attack that would hit it. To do so, the veteran must see the attacker and be wielding a melee weapon.; ; ,,,,,,,,,,,,,,,,,,,,,,,,,,,,,,,,,,,,,,,,,,,,,,,,,,Helmed Horror; Medium construct; neutral; 20; plate, shield; 60; 8d8+24; 30 ft., fly 30ft.; 18; 13; 16; 10; 10; 10; ; Perception +4; bludgeoning, piercing, and slashing from  nonmagical weapons that aren't adamantine; force, necrotic, poison ; blinded, charmed, deafened, frightened,  paralyzed, petrified, poisoned, stunned; blindsight 60 ft. (blind beyond this radius), passive Perception 14; understands the languages of its creator but can't speak; 4; 1,100; ; Multiattack.The helmed horror makes two longsword attacks.<br>Longsword. Melee Weapon Attack:+6 to hit, reach 5 ft., one target.<br>Hit:8 (1d8 + 4) slashing damage, or 9 (1d10 + 4) slashing damage if used with two hands.<br>; ; Magic Resistance.The helmed horror has advantage on saving throws against spells and other magical effects.<br>Spell Immunity. The helmed horror is immune to three spells chosen by its creator. Typical immunities include fireball, heat metal, and lightning bolt.<br>,,,,,,,,,,,,,,,,,,,,,,,,,,,,,,,,,,,,,,,,,,,,,,Hippogriff; Large monstrosity; unaligned; 11; ; 19; 3d10 + 3; 40 ft., fly 60 ft.; 17; 13; 13; 2; 12; 8; ; Perception +5; ; ; ; ; ; 1; 200; Keen Sight. The hippogriff has advantage an Wisdom (Perception) checks that rely on sight.; Multiattack. The hippogriff makes two attacks: one with its beak and one with its claws.<br><br>Beak. Melee Weapon Attack: +5 to hit, reach 5 ft., one target. Hit: 8 (1d10 + 3) piercing damage.<br><br>Claws. Melee Weapon Attack: +5 to hit, reach 5 ft., one target. Hit: 10 (2d6 + 3) slashing damage.; ; ,,,,,,,,,,,,,,,,,,,,,,,,,,,,,,,,,,,,,,,,,,,,,,,,,,,,,,,,,,,,,Hobgoblin Captain; Medium humanoid (goblinoid);  lawful evil; 17; half plate; 39; 6d8+12; 30 ft.; 15; 14; 14; 12; 10; 13; ; ; ; ; ; darkvision 60 ft., passive Perception 10; Common, Goblin; 3; 700; ; Multiattack.The hobgoblin makes two greatsword attacks.<br>Greatsword. Melee Weapon Attack: +4 to hit, reach 5 ft., one target.<br>Hit:9 (2d6 + 2) piercing damage.<br>Javelin. Melee or Ranged Weapon Attack: +4 to hit, reach 5 ft. or range 30/120 ft., one target. <br>Hit:5 (1d6 + 2) piercing damage.<br>Leadership (Recharges after a Short or Long Rest).For 1 minute, the hobgoblin can utter a special command or warning whenever a nonhostile creature that it can see within 30 feet of it makes an attack roll or a saving throw. The creature can add a d4 to its roll provided it can hear and understand the hobgoblin. A creature can benefit from only one Leadership die at a time. This effect ends if the hobgoblin is incapacitated.<br>; ; Martial Advantage. Once per turn, the hobgoblin can deal an extra 10 (3d6) damage to a creature it hits with a weapon attack if that creature is within 5 feet of an ally of the hobgoblin that isn't incapacitated.,,,,,,,,,,,,,,,,,,,,,,,,,,,,,,,,,,,,,,,,,,,,,,,,,,,,,,,,,,Hobgoblin; Medium humanoid (goblinoid); lawful evil; 18; chain mail, shield; 11; 2d8+2; 30 ft.; 13; 12; 12; 10; 10; 9; ; ; ; ; ; darkvision 60 ft., passive Perception 10; Common, Goblin; 1/2; 100; ; Longsword. Melee Weapon Attack:+3 to hit, reach 5 ft., one target. <br>Hit:5 (1d8 + 1) slashing damage, or 6 (1d10 + 1) slashing damage if used with two hands.<br>Longbow. Ranged Weapon Attack: +3 to hit, range 150/600 ft., one target. <br>Hit:5 (1d8 + 1) piercing damage.<br>; ; Martial Advantage. Once per turn, the hobgoblin can deal an extra 7 (2d6) damage to a creature it hits with a weapon attack if that creature is within 5 feet of an ally of the hobgoblin that isn't incapacitated.,,,,,,,,,,,,,,,,,,,,,,,,,,,,,,,,,,,,,,,,,,,,,,,,,,,,,,,,,Hook Horror; Large monstrosity; neutral; 15; natural; 75; 10d10+20; 30 ft., climb 30 ft.; 18; 10; 15; 6; 12; 7; ; Perception +3; ; ; ; blindsight 60 ft., dark vision 10 ft., passive perception 13; Hook Horror; 3; 700; ; Multiattack. The hook horror makes two hook attacks .<br>Hook. Melee Weapon Attack: +6 to hit , reach 10ft., one target. Hit: 11 (2d6 + 4) piercing damage.; ; Echolocation. The hook horror can't use its blindsight<br>while deafened.<br><br>Keen Hearing. The hook horror has advantage on Wisdom<br>(Perception) checks that rely on hearing.,,,,,,,,,,,,,,,,,,,,,,,,,,,,,,,,,,,,,,,,,,,,,,,,,,,,,,,,,,,,,Ixitxachitl; Small aberration; chaotic evil; 15; natural armor; 18; 4d6+4; 0 ft., swim 30 ft.; 12; 16; 13; 12; 13; 7; ; ; ; ; ; darkvision 60ft., passive Perception 11; Abyssal, Ixitxachitl; 1/4; 40; Aquatic creatures resembling mana rays, with small," clawed hands at the end of their ""wings"" and black eyes gleaming with sinister intelligence. ""Demon Rays"" is a common nickname.<br>; Bite. Melee Weapon Attack: +3 to hit", reach 5ft., one target. Hit: 4 (1d6+1) piercing damage.<br><br>Reactions:<br>Barbed Tail. When a creature provokes an opportunity attack from the ixitxachitl, the ixitxachitl can make the following attack instead of using its bite. Melee Weapon Attack: +5 to hit, reach 5ft., one target. Hit: 7 (1d8+3) piercing damage.; ; ,,,,,,,,,,,,,,,,,,,,,,,,,,,,,,,,,,,,,,,,,,,,,,,,,,,,,,,,